paper_id,title,text,keywords
15,"A Probabilistic Approach to the Evaluation of Seismic Resilience
in Road Asset Management","
1 Introduction 

The launch of the 55000 series ISO Standards for Asset 
Management between 2014 and 2019 represented a step 
change for the asset management community. The standard 
series focus on managing physical and intangible assets 
and provide a framework to establish asset management 
policies, objectives, processes, and governance, and facilitate 
an organization’s achievement of its strategic goals. 
The ISO standards point out that the risks and opportunities 
in managing assets need to be determined to prevent or 
reduce undesired effects (ISO 55001 2014; ISO 55002 
2018). 

With respect to risk assessment and management, reference 
is made to ISO 31000 standard launched in 2009 
and revised in 2018. According to ISO 31000 (2018), risk 
is the effect of uncertainty on an organization’s ability to 
meet its objectives, and risk management is a group of 
coordinated activities to direct and control an organization 
with regard to risk. The traditional definition of risk simply 
combines the probability of an event with its potential 
severity. Both definitions talk about the same phenomena 
but from two different perspectives. ISO thinks of risk in 
goal-oriented terms while the traditional definition thinks 
of risk in event-oriented terms. 

Over the last two decades, risk management has shifted 
from risk reduction and protection of critical infrastructure 
assets from potential hazards, initially highly concentrated 
on direct threats, to improving infrastructure resilience 
(that is, the ability to absorb and quickly recover from 
events) to a wider range of hazards, including both direct 
and natural threats (Fekete et al. 2014). 

The services provided by transportation and telecommunications 
systems, as well as water and electricity supply 
networks, are essential to our daily lives. The 

123 


Int J Disaster Risk Sci 

complexity of these networked systems has been increasing 
in recent decades, and has made them vulnerable. Transportation 
systems are among the infrastructure systems 
most affected by natural hazards and disasters (Keller and 
Atzl 2014; Utasse et al. 2016). Natural hazards are the main 
causes of transportation network disruptions in many 
countries, including Italy. Among these events, earthquakes 
are the costliest. Some good examples are the 
earthquakes that occurred in Sichuan, China (2008); 
Maule, Chile (2010); ToŻhoku, Japan (2011); Christchurch, 
New Zealand (2011); and L’Aquila (2009) and Emilia 
(2012) in Italy. Therefore, incorporating risk management 
and resilience assessment into transportation asset management 
(TAM) procedures is an extremely important 
factor in order to manage events and not passively suffer 
the consequences of natural hazards and disasters, and an 
in-depth focus on this topic is needed. 

2 Resilience Definition and Metrics 

The traditional way of coping with adverse events is to 
develop approaches and systems to identify and mitigate 
risks. Stochastic models are used to forecast future adverse 
events and to make better-informed decisions about how to 
manage risk. These traditional risk management practices 
have proven insufficient to adequately address the adverse 
events that have occurred. Therefore, standards, legislations, 
and policies that are implemented to support protection 
needs of critical infrastructure have shifted their 
attention from identifying risk and alleviating the level of 
vulnerability to trying to increase resilience (Flannery et al. 
2018). 

Following the Hyogo Framework for Action 
2005-2015 by the United Nations, definitions of resilience 
in transportation infrastructure systems have been discussed 
in some articles (Zhou et al. 2019). According to the 
literature, all definitions characterize resilience from one or 
both of two perspectives: (1) the capacity to maintain the 
serviceability (during a disaster event); and (2) the timing 
and resources required for restoring previous conditions 
(after a disaster event). Resilience of transport systems may 
be defined as the ability of transport systems to prepare for 
and adapt to a major disruption, providing and maintaining 
an acceptable level of service or functionality, and 
responding to and recovering rapidly from the disruption. 
Therefore, resilience measurement includes the time and 
level of performance the asset is able to sustain after an 
event occurs and before full performance is recovered 
(Fig. 1). The definition and illustration provided in Fig. 1 
are consistent with approaches proposed worldwide, 
according to which resilience can be represented by four 
properties: robustness, redundancy, resourcefulness, and 

recovery speed. During the disruption phase, the levels of 
robustness and redundancy affect the performance level of 
a transportation system. Robustness, in particular, determines 
the capacity to resist damages caused by disaster 
events, and redundancy suggests the presence of alternative 
resources. During the recovery phase, both resourcefulness 
and rapidity indicate the ability of the system to recover 
serviceability. 

In order to incorporate resilience into asset management 
processes, transport organizations need quantitative methods 
to measure the resilience of their systems to threats that 
may cause failures. Generally, there are two steps to 
measure a quantity. The first step consists of providing a 
metric for measurement, and the second step consists of 
computing the metric using some evaluation approaches. 
Currently, there is no unified measurement standard for 
resilience within road networks, both in terms of metrics 
and methods of assessment. 

The metrics used so far for the resilience measurement 
of transportation infrastructure can be divided into two 
categories: topological metrics and performance-based 
metrics. Topological metrics look only at the network 
configuration of the transport system but ignore the operating 
conditions and usually use some topological characteristics 
of transportation networks, such as shortest path 
length (Schintler et al. 2007; Berche et al. 2009), average 
node degree (Testa et al. 2015), or betweenness centrality 
(Aydin et al. 2018). Performance-based metrics evaluate 
the resilience of the network systems based on their performance 
during all periods of time affected by disasters 
(disruption, time at bottom level, and recovery). 

The three most widely used performance-based measures 
of resilience (MoR) are identified in the literature as: 

(1) the degradation of system quality over time; (2) the 
time-dependent function of quality during the restoring 
from disruption; and (3) the expected fraction of demand 
satisfied in the post-disaster network using specific recovery 
costs. Examples of performance-based MoR of type 1 
are those proposed by Twumasi-Boakye and Frangopol 
(Bocchini and Frangopol 2012; Twumasi-Boakye and 
Sobanjo 2018) and by Adjetey-Bahun et al. (2016), and are 
represented by Eqs. 1 and 2, respectively: 
Zt3 

R Ľ˝100 QtđŢdt đ1Ţ 

t0 

Zt3 

˝100 QtđŢ 

R Ľ dt đ2Ţ 
t 
t0 

where R is the value of resilience; t0 is the time when the 
disruptive event occurs; t3 is the time when the performance 
level of the system achieves the previous conditions 

123 


Nicolosi et al. Evaluation of Seismic Resilience in Road Asset Management 

Fig. 1 Phases of resilience 
measurement in road network 
functionality. PL = Performance 
level 
(see Fig. 1); and Q(t) is the quality/performance of the 
system (for example, based on total travel time or total 
travel distance). 

In type 2 MoR, resilience is dynamically represented as 
a temporal function, as opposed to the other types of 
indicators where resilience is a static indicator that represents 
the overall effects of disruption in the three phases 
following the occurrence of the event (see Fig. 1). An 
example of the performance-based MoR of type 2 is the 
one proposed by Liao et al. (2018) represented in Eq. 3: 

  Ftrjej Ftdjej

Rtrjej Ľ  đ3Ţ 

FtđŢ0 Ftdjej 

 

where Rtrjej is the resilience value of the system at time

 

trresulting from disruption ej; Ftrjej is the performance 
function of the system at time trresulting from disruption

 

ej; Ftdjej is the minimum performance function of the 
system resulting from disruption ej; and FtđŢ0 is the function 
of the system at the pre-disruption state. 

In type 3 MoR, resilience is defined as the expected 
fraction of demand satisfied by the network in the post-
disaster phases with specific recovery costs. These indicators 
thus have two characteristics: (1) they explicitly consider 
transportation demand; and (2) they consider the 
dependence of the post-disruption phases on the economic 
resources committed. An example of metrics of type 3 is 
provided by Vugrin et al. (2014), who proposed to assess 
resilience through the system of relationships shown in 
Eq. 4: 

RĽISPţRC đ4Ţ 

where ISPis the increase in cost of transport, including 
both increases in costs for flows on links and penalty costs 
for demand that cannot be accommodated; and RCis the 
resources needed to implement the scheduled tasks on 
damaged links in the network. If resilience is to be measured 
according to this performance-based MoR approach, 
road managers should aim at minimizing the Rvalue pertaining 
to their transport network. 

In general, many researchers consider the performance-
based metrics more suitable than topological metrics to 
measure the resilience in transportation networks, as the 
latter do not consider directly the effect on the users. 
Among the performance-based metrics, type 3 is often 
preferred over the other two because it takes into account 
the performance offered by the system during the entire 
time frame in which it was affected/disturbed by the disruptive 
event. Furthermore, the metrics that incorporate the 
economic resources required for recovery, which influence 
the recovery time, into the resilience evaluation, are better 
than the others, which usually fix as constraints the 
recovery resources. 

In the literature numerous approaches have been proposed 
to measure the level of service of transportation 
systems and calculate performance-based resilience metrics. 
These performance evaluation approaches are classified 
as: optimization models; simulation models; 
probability theory models; fuzzy logic models; and data-
driven models. Since the purpose of this study is not a 

123 


Int J Disaster Risk Sci 

literature review, the different approaches are not analyzed 
in detail, but optimization approaches are the most widely 
used (Zhou et al. 2019). They are primarily used to address 
two types of problems: (1) solving the traffic assignment 
problem, through deterministic or stochastic user equilibrium 
(UE) assignment algorithms; and (2) optimizing the 
utility of resources deployed for mitigation/preparation/ 
response/recovery. 

In this study, a metrics for evaluating the seismic resilience 
is proposed, based on both cumulative impact of 
disruption on system performance and the recovery 
efforts/costs. An operational procedure for stochastic 
evaluation of roadway rehabilitation costs is illustrated. 
The procedure was calibrated using data acquired for road 
infrastructure restoration during the 2016 earthquake in 
central Italy. 

3 Seismic Resilience Evaluation Methodology 

In this section the proposed procedure to stochastically 
evaluate rehabilitation costs due to a seismic event is 
presented. The discussion on the proposed methodology is 
first framed in a wider context pertaining to the resilience-
based performance evaluation for transportation networks. 
Subsequently, following the stochastically-based framework, 
the issue related to the assessment of recovery cost is 
addressed by highlighting the contributions by the seismic 
hazard and by the vulnerability of critical transportation 
assets. 

3.1 The Metrics for Assessing Seismic Resilience 
The objective is to introduce a methodology for the 
quantitative and stochastic assessment of the resilience of 
road networks to earthquake hazards. As resilience evaluations 
have to be considered as part of risk management in 
transportation asset management (TAM), the proposed 
methodology is consistent with the risk analysis criteria 
introduced in the ISO 31000 (2018) standards. In addition, 
the approach used to describe the randomness of seismic 
events complies with the procedures developed within the 
European design standards (that is, EN 1998-1 2004). 

The methodology developed in this study refers to a 
performance-based measure and a metric of the third type 
that explicitly considers the resources required for recovery, 
as explained in Sect. 2. Specifically, a cost-based 
resilience indicator composed of two addendums—the 
increase in the cost of transportation on the road network, 
and the cost of restoring the infrastructure following the 
occurrence of the seismic event—is proposed that can be 
expressed by means of the following: 

8 

Rr Ľ ODCr ţ ORCr

>P 

< 

ODCr Ľ GTCi post RCi;r  GTCi pre 

i đ5Ţ

PP  
: r; Vi;j

> ORCr Ľ RCi;j 
ij 

where ODCr is the overall delay cost of transport on the 
road network caused by an earthquake at a reliability level 
r (which has r probability of not being exceeded during the

 

period of analysis); GTCi post RCi;r is the generalized 
transport cost on the link i in the post-earthquake scenario 
that has r probability of not being exceeded during the 
period of analysis; GTCi_pre is the generalized transport 
cost on the link i in the pre-earthquake scenario; ORCr is 
the overall recovery cost at a reliability level r; RCi,j (r, Vj,j) 
is the recovery cost function on the element j (for example, 
bridge, tunnel,and so on) of the link i (having as independent 
variable the vulnerability V of the element and the 
reliability r). 

The cost of transport on the different links of the network 
is determined by redistributing traffic on the road 
network after and before the earthquake by solving the 
traffic assignment problem, through user equilibrium 
assignment algorithms. These issues and the evaluation of 
the ODCr component have been discussed by D’Apuzzo 
et al. (D’Apuzzo, Esposito, et al. 2019; D’Apuzzo, Evangelisti, 
et al. 2019; D’Apuzzo et al. 2020). This study 
focused on a methodology developed for the evaluation of 
the recovery cost, and in particular the recovery cost 
functions calibrated on the basis of data acquired during the 
2016 earthquakes in central Italy. 

3.2 Stochastic Recovery Cost Function 
for the Resilience Evaluation 
In the method proposed in this study for risk management, 
the effects are measured in terms of economic damage D, 
or rather resources needed to restore infrastructure functionality 
after an event. The effects or consequences of a 
natural event in general, and an earthquake in particular, 
depend on two factors: 

• Magnitude of the action that for earthquakes is 
measured by the PGA parameter (that is, maximum 
or peak ground acceleration that may occur during an 
earthquake in a specific location); 
• Vulnerability of the infrastructure, that is, the ability of 
the construction to withstand actions of a certain type. 
Provided the stochastic nature of the involved factors, the 
probability that during a period of time T, an economic 
damage higher than or equal to D occurs in an asset 
element having vulnerability V, can be expressed by the 
following: 

123 


Nicolosi et al. Evaluation of Seismic Resilience in Road Asset Management 

FDđ ; T; VŢĽPđD; VjT; PGAŢPTđ ; PGAŢđ6Ţ 
where F(D, T,V) is the probability that, during a period of 

time T, an economic damage higher than or equal to 

D occurs in an asset element having vulnerability V; P(D, V 
| T, PGA) is the conditional probability of having a damage 
greater than or equal to D in an asset element having 
vulnerability V for a given earthquake with a magnitude 
higher than or equal to PGA in a period of time T; P(T, 
PGA) is the probabilistic seismic hazard function (that is, 
probability of having almost one earthquake with a mag


nitude higher than or equal to PGA in a period of time 

T) defined below. 
10-2 
10-1Probability of exceedence in the period of analysis
1 1.5 2 2.5 3 3.5 

3.2.1 Seismic Risk Assessment 
PGA (m/s2) 

Seismic hazard maps that provide peak ground acceleration 
(PGA) at all sites for different probability of exceedance 
(PE) and/or for different return periods TR, are currently 
used in many European countries. The inverse of the return 
period is the average annual frequency recurrence k of the 
event linked to that intensity: 

k Ľđ7Ţ 

TR 

The plot of the values allows us to obtain the hazard 
curve. 

Normally the occurrence of a ground motion parameter 
at a site in excess of a specified level is modelled as 
Poisson process. Clearly this implies that any seismic event 
is independent of the occurrence of all others, and this 
could be approximately true for major earthquakes, 
excluding associated foreshocks, aftershocks, and so on. 
Applying this stochastic model, the probability of occurrence 
of n events, which have intensity (PGA) higher than 
the one corresponding to the average frequency of recurrence 
k, in a time interval t, is: 

n

đk tŢ 

PnđŢĽPn Ľe kt đ8Ţ 

n! 

Consequently, it is possible to evaluate the recurrence 
law to predict the probability of at least one exceedance in 
a period t: 

Pnđ1ŢĽ1 PnĽ0 Ľ1 e kt đ9Ţ 

An example of a probabilistic hazard curve is shown in 
Fig. 2. 

3.2.2 Cost Damage Function 
Although the probabilistic seismic hazard function can be 
easily evaluated by means of a seismic hazard curve, 
evaluation of the conditional probability P(D, V|T, PGA)of 

Fig. 2 Example of a typical hazard curve in a site for a time period of 
10 years. PGA = Peak ground acceleration 

having a damage greater than or equal to D in an asset 
element having vulnerability V for a given earthquake with 
a magnitude higher than or equal to PGA in a period of 
time T is more complex, since it requires information on: 
the vulnerability of different road sections; the damage the 
different road assets underwent following a real seismic 
event; the corresponding seismic magnitude of the analyzed 
event (also evaluated according to site conditions); 
and the corresponding recovery or reconstruction cost 
borne to restore the ex ante serviceability conditions. 

Since all these data are of stochastic nature, an economic 
damage function, D, can be represented through a 
stochastic function: 

D Ľf đPGA; VŢđ10Ţ 

where f (PGA, V) is the cost damage function that returns 
the average economic damage in an element of the transportation 
asset having vulnerability V when an earthquake 
of ‘‘PGA’’ magnitude occurs. 

Therefore if data on recorded PGA and on vulnerability 
values for the different road assets (viaduct, tunnel, 
embankment, trenches) can be collected for a wide area 
subjected to a given seismic event, it is possible to 
empirically derive a functional form for the economic 
damage function, D, by combining all the collected 
information. 

3.2.3 Vulnerability 
The seismic vulnerability of a structure is a quantity 
associated with its weakness/strength in the case of earthquakes 
of a given intensity, and expresses the probability 
that buildings will suffer damage due to a seismic phenomenon. 
Different seismic vulnerability assessment 

123 


Int J Disaster Risk Sci 

methods have been proposed in the literature and can be 
divided into three main groups—empirical methods, analytical 
methods, and hybrid methods (Shabani et al. 2021). 

Many of the analytical methods share the same 
assumption that the gap (or ratio) between the actual 
seismic demand and the seismic capacity of the structure 
(or the seismic demand at the time of the design) can be 
considered as an indicator of structural performance deficit. 
Therefore, in this research, the following quantitative 
seismic structural performance parameter is used to assess 
vulnerability: 

PGACi

RPGAi Ľđ11Ţ 

PGADi 

where i is the limit state considered (for example, ultimate 
limit state or serviceability limit state); RPGAi is the structural 
performance indicator in terms of PGA for limit state 
i; PGACi is the maximum extent of the actions that the 
structure is able to support, for limit state i, in accordance 
with the margins of safety imposed by the standards (that 
is, peak ground acceleration ‘‘capacity’’); PGADi is the 
expected seismic action stated by the standard for limit 
state i (that is, peak ground acceleration ‘‘demand’’). 

Values of the RPGAi indicator are typically between 0 
and 1: values close to 1 characterize cases where the reliability 
level is close to the one required by the standards; 
values close to 0 represent a much lower reliability than 
that allowed by the standards (high risk cases). The RPGAi 
indicator is analogous to the structural performance score 
(SPS) included in the New Zealand guidelines for assessing 
and improving the seismic performance of buildings during 
earthquakes (NZSEE 2014), or to the NODE indicator 
proposed by Iervolino (Petruzzelli and Iervolino 2021), and 
the quantity 1-RPGAi is related to the probability of damage 
(that is, vulnerability). Therefore, the RPGAi indicator has 
been used in this study to evaluate vulnerability (Table 1). 
Once all the involved factors had been defined, the proposed 
methodology was applied to data collected following 
a major seismic event that struck central Italy in 2016. 
Collected data and corresponding derived damage cost 
functions are reported below. 

Table 1 Vulnerability classes adopted by the current study for 
bridges (ultimate limit state, ULS) 

RPGA Vulnerability class 

R C 0.8 A (low) 

0.4 B R \ 0.8 B (medium) 
R \ 0.4 C (high) 
4 Data 

In this study, using the indicators previously illustrated, 
three classes of vulnerability were introduced, based on the 
RPGA (Table 1). In order to develop a recovery cost function, 
the data on the costs of the interventions on the 
national road network and PGAs recorded in the seismic 
events in central Italy during the years 2016-2017 were 
used. The analysis of the costs for the renewal of the road 
network was carried out on a regional scale, as extensive 
damage affected nine provinces (Fig. 3): Ascoli Piceno, 
Rieti, Macerata, Fermo, Perugia, Teramo, L’Aquila, 
Ancona, and Terni. The intensity of the seismic events that 
affected the territory in question in 2016 is reflected by the 
epicenters: 

• 24 Aug 2016, Epicenter at Accumoli (Rieti), Moment 
Magnitude Scale (MMS) 6,0; 
• 26 Oct 2016, Epicenter at Visso (Macerata), MMS 5,9; 
• 30 Oct 2016, Epicenter at Norcia (Perugia), MMS 6,5. 
Recovery and repair interventions were foreseen for 
several damaged engineering works, which were divided 
into two macro-groups: road sections (excavation/embankment) 
and bridges. The first one includes: road pavements, 
retaining walls, bulkheads, and every typology of 
complementary works designed to protect and support the 
road. The second one includes all types of bridges, 
regardless of construction technology. For each of the 
provinces affected by the earthquakes, the total costs 
related to the interventions on the roads and bridges were 
assessed. The former was related to the length of the road 
network (excluding bridges), the latter to the total length of 
the bridges existing in the road network; therefore, it was 
possible to obtain costs per unit length. These values are 
listed in Table 2 (last two columns). 

To characterize the intensity of the seismic events, the 
PGA was selected as the reference seismic parameter. 
Since the aim was to perform an analysis with a regional 
extension, the effects of local amplification of ground 
motion were not considered. Therefore, the data of the 
ground accelerations recorded during the seismic events 
were processed. To perform this operation, the database of 
Project Orfeus, called the Engineering Strong-Motion 
Database, was used (Luzi et al. 2016). It allowed us to 
obtain all the engineering seismic parameters recorded by 
acceleration stations during the ground shaking, such as 
ground acceleration, velocity, displacement, and response 
spectrums. 

For each of the seismic events, the data relative to the 
peak ground accelerations recorded by 60 accelerometric 
stations in the area of interest were analyzed. Subsequently, 
a mean value, restricted to administrative boundaries and 

123 


Nicolosi et al. Evaluation of Seismic Resilience in Road Asset Management 


Fig. 3 Map of Italy showing the study area and the affected provinces and epicenters of the earthquakes considered 

Table 2 Repair costs per unit length of roads and bridges in the compared with the values provided for the ultimate limit state 
central Italian study area road network and average values of peak (ULS) by the construction standards (NTC 2018) 
ground accelerations (PGAs) recorded during the earthquakes, 

Provinces Regional PGA (m/s2) PGA (ULS) (m/s2) Road body repair cost (k USD/km) Bridges repair cost (k USD/km) 

Ascoli Piceno 3.09 3.08 193.6 8075.5 
Rieti 2.47 2.95 49.3 5353.5 
Macerata 2.43 3.12 100.6 1227.6 
Fermo 1.46 3.31 27.2 150.5 
Perugia 1.40 3.03 23.0 2003.1 
Teramo 1.01 3.12 6.7 307.3 
L’Aquila 0.86 4.44 0.5 – 
Ancona 0.64 3.12 3.0 – 
Terni 0.32 2.64 0.4 45.0 

damaged areas, was calculated (see the first column of 
Table 2). 

Additional data related to the ultimate limit state of 
collapse (ULS) can be added to the data collected and 
previously illustrated. The main European and US regulations 
promote the principle according to which the ‘‘nocollapse’’ 
requirement (that is, ‘‘The structure shall be 

designed and constructed to withstand the design seismic 
action without local or global collapse, thus retaining its 
structural integrity and a residual load bearing capacity 
after the seismic events’’ (EN 1998-1 2004, paragraph 2.1, 

p. 29)) is achieved for design seismic action associated 
with a low reference probability of exceedance (5-10%) in 
a reference period (for example, 50-200 years) (EN 
123 


Int J Disaster Risk Sci 

1998-1 2004; AASHTO 2010; FHWA 2014; NTC 2018). 
In this case study of central Italy, the following criterion 
was chosen: 5% reference probability of exceedance in a 
reference period of 200 years (class IV suggested for 
national two-lane highway and motorway according to 
NTC 2018). The choice is based on both the necessary 
agreement between the experimental data and related 
Italian regulations, and above all, the most precautionary 
target. However, the criteria and thresholds chosen are 
consistent with those adopted in most of the more economically 
developed countries. Therefore, the seismic 
action linked to this return period can be associated with 
the total reconstruction cost of the road element. On the 
basis of analyses carried out by the Ministry of Transport, 
the parametric cost of reconstruction (carriageway about 12 
m wide) for the bridges and the road sections (general road 
cross-section excavation or embankment) is 12,680.40 and 
2,488.00 thousand USD/km, respectively. 

Finally, it must be considered that the cost for the same 
seismic action depends on the vulnerability. Vulnerability 
data were provided by the national road organization 
ANAS (Azienda Nazionale Autonoma delle Strade/Italian 
National Road Company). This allowed the identification 
of low and high vulnerability infrastructural systems, with 
reference to the ultimate limit state (ULS) risk values of 
Table 1. For ordinary road sections there is currently no 
classification according to vulnerability so it has not been 
possible to distinguish the data. 

5 Results 

The data on earthquake intensity and road damage collected 
allowed the development of cost functions through 
statistical regressions. Considering that these functions 
must tend to zero for PGA = 0 and to cost of reconstructions 
for PGA of the ultimate limit states, it was decided to 
use a sigmoidal function. The cost functions identified are 
shown below and represented for bridges and excavation/ 
embankment road sections, respectively, in Figs. 4 and 5: 

b 

D Ľa ţđ12Ţ 

đ1 ţexpđc PGA ţdŢŢ 

where a Ľ b , b is the maximum cost corre


đ1ţexpđŢd Ţ 

sponding to the cost of reconstruction (Table 3); c is a 
constant that governs the form of the function and is 
assumed to be the same for all levels of vulnerability 
(Table 3); and d is a constant, or rather a translation factor, 
which depends on the level of vulnerability (Table 3). 

Because there are no vulnerability data for ordinary road 
sections, the regression function obtained has been attributed 
to a medium vulnerability, and the functions for high 

and low vulnerability have been obtained by shifting this 
function similarly to that found for bridges. 

Due to their generality, cost functions can be considered 
valid for the whole national territory. Finally, the introduced 
functions represent two elements of seismic risk 
analysis: vulnerability (V), and exposure (E). The cost 
functions identified so far are stochastic and link the PGA 
to the damages. To account for the random effects of the 
seismic phenomenon, it is necessary to use the stochastic 
model shown earlier for PGA (see Sect. 3.2.1 and Eq. 8). 

After defining a period of analysis (for example, T =10 
years, see Fig. 2) the hazard curves can be obtained. Using 
the cost function determined earlier, it is possible to substitute 
the recovery cost for the PGA in the hazard curve. 
This yields a stochastic representation of the recovery cost 
due to seismic events RCi,j (r, Vi,j) (Fig. 6), which is one of 
the addendums of the resilience indicator to be used in road 
asset management, as mentioned in Sect. 3.1. With the 
reliability (that is, the probability to not exceed a cost) 
decided and the vulnerability of the element known, the 
expected recovery cost is obtained. This result can also be 
useful in the evaluation of budget plans for future retrofitting 
interventions by highway network managers, and 
since the employed vulnerability and hazard criteria are 
consistent with the regulations adopted in the European 
Union and the United States, they may represent an 
effective tool for most highway managers worldwide. 

Moreover, although it is fair to assume that design and 
construction techniques for bridges and excavation/embankments 
road sections are similar in most of the more 
economically developed countries, the sigmoidal function 
allows to ‘‘scale’’ reconstruction costs (by choosing a 
suitable value for the b parameter) conveniently in order to 
adapt the evaluation to the specific national economic 
situation. 

6 Conclusion 

Introducing resilience into road asset management systems 
requires the establishment of effective metrics and robust 
systems for evaluating them. This article presents a 
stochastic metric for assessing the resilience of road networks 
against disruptive seismic events and a framework 
for performing its evaluation. Given that the ultimate goal 
of a road network’s resilience is to ensure the continuity of 
its normal functions, the metric chosen is based on changes 
in total costs (that is, maintenance/restoration costs and 
transportation costs). The cost-based assessment allows for 
the quantification of resilience, for all three phases usually 
considered (see Fig. 1), using a single unit of measure for 
the different addendums. 

123 


Nicolosi et al. Evaluation of Seismic Resilience in Road Asset Management 

Fig. 4 Empirical cost function 
with three vulnerability levels 
for bridges in the central Italian 
study area 

Fig. 5 Empirical cost function 
with three vulnerability levels 
for roads in the central Italian 
study area 

Damage cost (k USD/km) Damage cost (k USD/km) 

$14.000 
$12.000 
$10.000 
$8.000 
$6.000 
$4.000 
$2.000 
$0 

0 

$3,000 
$2,500 
$2,000 
$1,500 
$1,000 
$500 
$0 

0 

HighMediLowvulnerability (HV)
um vulnerability (MV)
D funD funvulnerability (LV)
ction (MV)
ction (HV)
D function (LV) 


12345 

PGA (m/sec) 

Medium vulnerability 
D function (MV) 
D function (HV) 
D function (LV) 
12345 

PGA (m/s) 

Table 3 Parameters of the sigmoidal cost function for assets, bridges, and road sections related to the three levels of vulnerability in the central 
Italian study area 

Function Parameters Bridge 
vulnerability 
Excavation/embankment road sections vulnerability 
Medium High Low Medium High Low 
b 
(k USD/km) 
c 
$12,680.40 
-4.2219 
$12,68","Italy  Resilience metrics  Road asset
management  Road network resilience  Seismic hazards"
