paper_id,title,text,keywords
1,"Transportation system performance capabilities for vulnerable
populations","1. Introduction 
Transportation systems have a critical role in the functioning of societies as they facilitate the mobility of users and freight, the 
provision of essential services, and the achievement of economic prosperity [1]. However, these systems are under continuous pressure 
to perform with the increasing intensities and frequencies of natural and technical risks. The stress on the capital required tomanage the infrastructure after the occurrence of a disruptive event calls for a shift in the traditional practices of planning and managing 
the resilience of transportation systems [2–4]. Current resilience management practices are primarily focused on ‘engineering resilience’ 
concepts. Engineering resilience conflates resilience and risk perspectives by exclusively expressing resilience in risk terms 
[4,5]. Such practices have led to approaches that focus on mitigating the threats on the physical components of the transportation system; 
rarely including guidelines to reduce the negative consequences on the users of the system, especially socially vulnerable users. 

* Corresponding author. 
E-mail addresses: mha19@fsu.edu, mazinhkarim@gmail.com (M. AbdelMagid). 
https://doi.org/10.1016/j.ijdrr.2023.103991 

Received 13 January 2023; Received in revised form 13 July 2023; Accepted 4 September 2023 


M. AbdelMagid et al. 
Transportation systems are complex social and technical systems that have constant interactions with the surrounding environments, 

e.g. open-loop systems [6]. This dual nature (socio-technical) makes pure engineering approaches weak in producing effective decisions 
related to fostering resilient and sustainable infrastructure systems [7]. Existing resilience guidelines are mostly designed basedon the assumption that individuals can adequately respond to and apply instructions, thereby, failing to account for the fact that aconsiderable percentage of the population can be deemed vulnerable to disasters due to their preexisting demographic and social conditions 
[8–10].
The World Health Organization defines vulnerability as: “the degree to which populations, an individual, or an organization is unable to 
anticipate, cope with, resist and recover from the impacts of disasters” 
[11]. The Centers for Disease Control and Prevention (CDC) define 
vulnerable populations as those who [1] have difficulty communicating [2], have difficulty accessing medical care [2], may need help 
maintaining independence [4], require constant supervision, and [5] may need help accessing transportation. The aforementioned 
characteristics are what define vulnerability in the general context; however, specific guidelines are needed to identify these populations 
in the context of mobility, especially in the case of natural hazards. It is critical to define these aspects of vulnerability becausethey define the needs of the populations that require special attention in transportation planning. Understanding the interactions between 
the social and technical components of the transportation system, especially as it relates to vulnerable populations’ 
needs, is 
important for the efficient and equitable allocation of investments and resources to improve the state of the resilience of the transportation 
system. 

The key motivation behind this research is the repositioning of transportation resilience practices toward the needs of vulnerablepopulations. Vulnerable populations in this research are (i) older adults,(ii) ethnic minority groups, and (iii) rural populations, in the 
State of Florida. The natural hazards affecting vulnerable populations in the study are limited to hurricanes and storm surges. The 
academic goal of this paper is to expand our understanding of the transportation system's resilience from the perspective of vulnerable 
populations. To achieve this, we address three specific research questions. 

• 
What are the social vulnerability characteristics that create vulnerability in the context of mobility? 
• 
What are the shortcomings of the current resilience practices in addressing the vulnerabilities of the focus groups of the study? 
• 
What resilience capabilities of the transportation system contribute to enhancing the system's performance for vulnerable 
populations? 
This paper expands the understanding of the user-system relationships and highlights the shortcomings of current resilience planning 
practices, especially for the benefit of disadvantaged groups. Mixed qualitative-quantitative approaches are used to address the 
research questions, and a hierarchical transportation system performance evaluation (SPE) framework is developed. Using a constructivist 
grounded theory. The set of users' needs and concerns obtained through surveys are transformed into performance capabilitiesto allow transportation agencies to evaluate the system's resilience for the needs of vulnerable populations. We conclude the paper byproposing a framework that offers guidance for transportation agencies to formally incorporate the needs of vulnerable populations intheir documented plans to improve the transportation system's resilience during natural hazards. 

2. Research approach 
This research uses an inductive mixed-methods approach in the development of the system-performance evaluation (SPE) framework 
for the needs of vulnerable populations. The data is collected and analyzed in two main phases. The first phase involved a comprehensive 
literature review to identify the characteristics that lead to vulnerability in the context of mobility. The literature review 
also focused on highlighting the shortcomings of current resilience practices in addressing the needs of vulnerable populations. In the 
second phase, two sets of surveys (vulnerable populations, and transportation experts) were disseminated to assess the perceptions of 
the vulnerable groups and the transportation experts of the users' needs-system's performance relationships. A relative importance index 
was utilized to prioritize the users' needs and evaluate the current state of the system's resilience. The second phase also involvedthe identification of resilience performance capabilities that support the needs of vulnerable populations, and the development of the 
conceptual system-performance (SPE) framework to reflect the different levels of system resilience using a constructivist grounded 
theory (CGT), relying on the information extracted from the literature review and the surveys. Fig. 1 presents the research framework 
followed in the research. 

3. Literature review 
3.1. A critique of current resilience practices for the needs of vulnerable populations 
The term resilience, which originated in the early 20th century [12], has gained prominence through C.S. Holling's definition 
within the ecological systems context [13]. It is evident from extensive literature reviews that resilience is a shared concept across 
various fields, representing the capacity of an element or system to recover stability following a disruption [14]. Holling further categorized 
resilience into engineering and ecological domains [15]. Engineering resilience emphasizes the ability to rebound quickly, endure 
higher stresses, and minimize disturbances [16]. However, current infrastructure resilience management practices primarily focus 
on engineering aspects, neglecting management processes such as planning, preparation, and adaptation, as well as the diverse resilience 
capacities of infrastructure users. Consequently, there is a pressing need for an inclusive approach that bridges engineering 
and social science practices, enabling a comprehensive understanding of resilience in complex infrastructure systems and facilitatingthe development of actionable metrics to inform resilience decisions [17]. 


M. AbdelMagid et al. 
(Image of Fig. 1) 
Fig. 1. Research framework. 

The literature review indicates that the resilience of transportation systems aligns closely with the principles of engineering resilience. 
It emphasizes the ability of a transportation system to uphold its functionality during disruptions and the subsequent effortsneeded to restore its performance level [18–20]. The current resilience management practices that primarily focus on engineering resilience, 
conflates resilience and risk perspectives by exclusively expressing resilience in risk terms [5], treating resilience as a static 
property of the system. This results in frameworks that are only as effective as the predictive capacity of future events [3] and overlook 
the dynamic and emergent nature of challenges facing the infrastructure system. By neglecting the dynamic nature of resilience,
these practices equate system resilience with system stability, disregarding the criticality of adaptation in resilience planning [21,22].

In the context of a rapidly changing environment characterized by heightened unpredictability in recent events, there is a growing 
imperative to recognize the limitations of conventional risk-based planning approaches. The paradigm of relying solely on historicaldata and deterministic models to inform infrastructure development and resilience strategies is proving inadequate in addressing thechallenges posed by uncertain and unforeseen risks. As such, there is a need to embrace alternative strategies that facilitate adaptability 
and flexibility in the face of evolving circumstances. Acknowledging the inherent uncertainties and leveraging approaches that incorporate 
adaptation to account for and respond to dynamic and unpredictable risks becomes paramount for fostering resilience incomplex infrastructure systems [23–25].Recent research efforts have been dedicated to integrating the concepts of adaptation and 
flexibility into resilience practices, specifically in response to wicked problems like black swan events and surprise events [24–28].
These efforts signify an evolutionary paradigm within engineering resilience, aimed at equipping infrastructure systems to effectivelyconfront the emerging challenges that render the traditional practices ineffective in preserving the infrastructure assets. By addressing 
the limitations of traditional risk-based utility maximization approaches in infrastructure resilience planning, these initiatives 
seek to enhance the system's preparedness in the face of deep uncertainties. However, despite these advancements, there has been a 
lack of active efforts to comprehend the diverse response capacities of infrastructure users and their impact on overall system re



M. AbdelMagid et al. 
silience. It is evident that a significant portion of the population is vulnerable to disasters due to preexisting demographic and socialconditions [8–10]. Therefore, inclusive considerations of vulnerable populations in resilience planning are crucial for fostering equitable 
development of infrastructure systems. 

3.2. Transportation systems resilience equity in an age of uncertainty 
A significant limitation of the standard model in infrastructure resilience lies in its failure to consider the inherent variation in sociodemographic 
characteristics among subpopulations and the disproportionate exposure of vulnerable groups to risks. This disparity 
stems from the flawed assumption within the standard model that treats the public as a homogeneous entity [29]. By narrowly focusing 
on the physical performance of the transportation system and treating the impacts of disruptions as uniform, the traditional approach 
inadvertently overlooks critical equity efforts. It disregards the reality that different user groups possess diverse levels of response 
capabilities and available resources, perpetuating an inequitable distribution of resilience efforts [30].

Mounting evidence highlights the disproportionate impact of disasters and infrastructure service disruptions on specific subpopulations 
within communities, underscoring their heightened vulnerability. However, existing research and resilience practices have inadequately 
addressed the sociodemographic factors contributing to these disparities, and there is a lack of data concerning inequity in 
resilience planning [31,32]. While academics and professionals acknowledge this inequity, the recognition often fails to translate into 
concrete efforts, such as policy changes and resource allocations, aimed at promoting equity and the active consideration of the special 
needs of vulnerable populations [33]. Compounding this challenge is the nature of the traditional risk-based planning approaches, 
which rely heavily on data availability to inform deterministic policies for infrastructure management. Consequently, the 
lack of information regarding the societal impacts of infrastructure service disruptions on vulnerable populations discourages decision-
makers from making active efforts to address equity considerations, as evidence from behavioral psychology shows that individuals 
tend to prioritize immediate concerns rather than long-term problems, i.e., hyperbolic discounting [34].

Emerging critiques of resilience practices in academic literature shed light on the inadequacy of the concept in addressing equityissues. Even when equity is considered, it often revolves around the even distribution of resources, overlooking the complexities of 
identities and the diverse needs of different subpopulations [35]. Moving forward, it is imperative for resilience practices to explicitly 
address the aspect of ""resilience for whom"" and recognize the variations in vulnerabilities and response capabilities among different 
subpopulations [36]. It is crucial for practitioners to develop formal frameworks that incorporate equity considerations into resilience 
plans, as this is a pivotal step in advancing resilience efforts. By acknowledging and actively addressing the challenges faced by vulnerable 
communities, cities can be transformed into resilient environments that cater to the needs of all residents. 

3.3. Vulnerabilities in mobility: understanding the context 
Vulnerability has various definitions depending on the research orientation and perspective [37]. To improve asset management 
practices, it is critical to recognize the variability in the vulnerabilities of the groups exposed to the hazards and develop place-
specific plans accordingly [38]. A review of the vulnerability literature [39–44] indicates that to understand what defines a context-
specific vulnerability (mobility in this research), it is essential to look at social vulnerability beyond the concepts of hazards and risksand expand the consideration to include complex problems related to the issues of residence, resilience, and the resources available 
for the community. Consideration should be given to these factors when there are attempts to determine vulnerable populations in the 
context of mobility (hereafter referred to as mobility-vulnerability), especially those who suffer more negative consequences due to 
natural hazards. 

Residence, as a determinant of mobility-vulnerability, involves considering several variables. These variables include the specific 
physical and environmental hazards associated with a location, the quality of infrastructure in that area and its ability to withstand 
hazards, and the differential access to resources within the community. Analyzing vulnerability based on residence yields varying distributions 
of vulnerable populations, as the choice of variables significantly impacts the results. This observation is supported by research 
combining geophysical risks and social vulnerability indicators in Hillsborough County, Florida [44,45].

Resilience is understood as a construct representing individuals' capability to respond to problems through a hierarchy of response 
mechanisms. It is considered one of the attributes of vulnerability, which measures the level of exposure to hazardous conditions 
[44]. Resilience is measured by the ability to possess and manage various attributes that facilitate effective response to hazards, such 
as efficient utilization of information from emergency communications, effective resource management, and individual capacity for 
proactive decision-making [46]. The absence of resilience in a group increases their vulnerability, even if other attributes are comparable. 
For instance, an individual with a college degree may be less vulnerable than an illiterate person with similar resources due totheir ability to leverage available information and mitigate the impacts of risks. It is important to note that the term ""resilience"" used 
here differs from the concepts discussed earlier (and later) in the paper. In this section, the focus is on the attributes unique to individuals 
or population groups that contribute to heightened vulnerability but are not directly linked to geophysical threats or resourceavailability. 

Accessibility to resources is an attribute that indicates the level of social resilience of a society; however, some academic opinionsargue that the resources attribute should be kept separate because it can be considered a unique measure for the level of social vulnerability 
which is different from the measures discussed in the resilience subsection above [47–49]. Accessibility to resources is related 
to the ability of an individual/group to respond to hazards, and, unlike the preexisting conditions, the accessibility to resources can be 
managed to reduce the level of vulnerability of vulnerable groups. 

In this research, an examination of sociodemographic characteristics was conducted to understand the variation in mobility vulnerability, 
leading to heightened exposure to risks from natural hazards. These characteristics were derived from the Centers for Disease 
Control and Prevention's (CDC) social vulnerability index (SVI), which categorizes sociodemographic factors into socioeconomic 


M. AbdelMagid et al. 
status, racial/ethnic groups, household composition, and housing style. The SVI's characteristics were specifically analyzed within the 
context of mobility vulnerability, and the findings are summarized in Table 1. By comparing these attributes with those obtained from 
the literature (discussed earlier) four major attributes were identified that contribute to increased levels of mobility vulnerability,
these are outlined in Table 2. 

This study identifies three socially vulnerable groups: ethnic minority populations, rural communities, and elderly individuals (aged 65 
years and older). Ethnic minority groups are considered vulnerable as they often face higher levels of socioeconomic disadvantagesand systemic inequities, and they are usually linked to increased levels of disaster impacts [50]. Rural populations face vulnerability 
stemming from lower quality infrastructure and services, as well as limited emergency response capacities [51]. While the elderly 
population exhibits vulnerability due to their reduced resilience capabilities and coping capacities [52].

We note that focusing on these specific groups is a starting point. Rather than aiming for full inclusivity, this research aims to understand 
the reasons behind the oversight of equity considerations in resilience planning. Through the surveys, the goal is to gain 
comprehensive insights into the needs and concerns of disadvantaged groups. These insights will inform the development of targeted 
strategies and recommendations to promote equitable resilience practices. 

4. Methodology 
4.1. Study context 
The study aimed to investigate the transportation systems resilience for vulnerable populations in the state of Florida by employing 
two sets of surveys: populations' surveys targeting the three vulnerable population groups and an experts’survey targeting professionals 
that work with the needs of vulnerable populations. The objective was to gather empirical data regarding the concerns and 
needs of vulnerable populations during natural hazards (such as hurricanes and storm surges), while also exploring the perception oftransportation professionals regarding the resilience of the system and the concept of equity within their institutions. 

By evaluating the resilience of the transportation system specifically for the needs of vulnerable populations, the study shed light 
on the issue of equitable resilience practices and identified areas where current resilience efforts may be lacking. The collected surveydata was analyzed to develop a comprehensive portfolio of needs that vulnerable populations require from a resilient transportationsystem. In the light of these needs. 

This study represents a practical step towards understanding the gap between resilience and equity planning. While the existing 
literature has highlighted this shortcoming primarily through theoretical discussions, our research offers empirical evidence of this 
disunion. In efforts to bridge the gap between theory and practice, we constructed Transportation System Performance Evaluationand Analysis frameworks that actively consider equity in resilience planning. These frameworks serve as a practical tool to assess and 
enhance the equitable aspects of transportation system resilience, enabling decision-makers to make informed and inclusive planning 
decisions. By generating a preliminary list of equitable resilience capabilities, our study establishes a foundation for integrating equity 
considerations into resilience planning processes and fostering more equitable and inclusive transportation systems. 

4.2. Survey development 
Web-based surveys were designed to collect data and understand the perceptions of both users and experts regarding the resilienceof the transportation system. The surveys followed a similar structure and consisted of four main sections: previous disaster experiences, 
mobility and resilience, economic impacts of hazards, and social impacts of hazards. Descriptions of these survey sections can 

Table 1 

Mobility-related social vulnerability characteristics. 

Attribute(s) Vulnerable Group(s) Circumstance(s) -Mobility Attributes 
Age 
Physical, mental, cognitive, and 
emotional status 
Culture, ethnicity, language, 
religion, citizenship, and other 
socioeconomic statuses 
Young children. Senior citizens. 
Disabled. Suffering from chronic physical and/or mental 
illness. Socially isolated. Individuals with limited coping 
capacities. 
The poor (or low-income individuals). Minority groups. 
Migrants. Socially marginalized. Socially isolated. Low-
literacy and illiterate individuals. Non-English speakers. 
Less mobile. Dependent. Need help accessing transportation 
Less mobile. Have difficulties communicating. Dependent. 
Require constant supervision. Need help accessing 
transportation. May depend on technology-based life support. 
Scarcity of resources. Have difficulties communicating. Need 
help accessing transportation. 

Table 2 

Mobility-vulnerability attributes. 

Personal 
circumstances 
PhysicalVulnerability 

Social Vulnerability 

Resources 

Exposure to hazardsLocation-dependent 
resources 
Individual 

Community level 

Individual 
Community level 

Age, chronic diseases, mental illnesses, disabilities … 
etc. 

Risks unique to the area (e.g., flood zones)
Quality of infrastructure and its related services 

Coping capacities, behavior during hazards, capabilities of understanding emergency guidelines, response 
capacities, recovery capabilitiesResilience capabilities of institutions: availability of data, efficiency of planning, emergency response capacities, 
organizations' resources (e.g., budget allocated to risk response)
Personal/household income, vehicle ownership 
Community services (e.g., evacuation assistance, post-hazard support) 


M. AbdelMagid et al. 
be found in Appendix A. For the populations' surveys, an opt-in web-based surveying panel called Pollfish was utilized. Opt-in surveys 
provide a fast and convenient means of data collection, particularly when specific characteristics are required from a large pool of 
participants. While it is acknowledged that opt-in surveys may attract a non-representative set of respondents, empirical evidence 
demonstrates that qualitative conclusions reached are comparable to those of probability-based sampling methods [53]. The target 
subjects for the populations' surveys were residents in areas corresponding to the I-4 corridor, which included counties within the East 
Central Florida Regional Planning Council, Central Florida Regional Planning Council, and Tampa Bay Regional Planning Council. To 
ensure adequate representation of rural populations, rural zip codes in Florida were identified using the definition of rurality provided 
by the Florida Department of Transportation Office of Policy Planning (FDOT OPP). By applying spatial analysis to the Federal 
Office of Rural Health Policy's (FORHP) zip code files and Census Bureau's 2018 American Community Survey (ACS) Zip Code Geography, 
201 rural zip codes and 807 urban zip codes were identified. Fig. 2 depicts the rural areas in the state of Florida. The study focused 
on residents within the Interstate-4 (I-4) corridor for the populations' surveys. 

The target subjects for the expert surveys were professionals associated with organizations or roles in four areas relevant to vulnerable 
population needs: affinity groups, emergency management agencies, transportation offices, and planning agencies. The surveys 
were developed and initially tested with a panel of experts at the Florida Department of Transportation (FDOT) in December 2020. 
Based on their feedback, a final version was developed and deployed in March 2021. 

In terms of response rates, the populations' surveys collected a total of 630 responses (210 from each vulnerable group). Since each 
survey corresponding to the three vulnerable groups (ethnic minority populations, rural communities, and elderly individuals) was conducted 
independently, duplicates were encountered due to overlapping characteristics among respondents (e.g., an elderly individual 
residing in a rural area). Consequently, only unique responses were considered for analysis, resulting in a final dataset of 608 distinct 
samples. In social research, a sample of this size is considered significant, with a precision level of 5%, a confidence level of 95%, and 
P = 0.5 [54]. For the expert survey, out of the 79 individuals who received the survey, 40 participated and completed it, yielding an 
overall response rate of 51%. While it is acknowledged that the sample of experts may not be representative in a strict statistical 
sense, our focus was not on subjective opinions but rather on understanding the existence of plans and measures within institutions. 
Therefore, we determined that a response rate of 51% from the selected professionals would be acceptable to achieve the study's objectives. 
The breakdown of response rates within specific areas of expertise was as follows: 50% within the affinity group, 65.22% 
within emergency management agencies, 58.33% within transportation offices, and 27.27% within planning agencies. The respondent 
pool encompassed a wide range of occupational specializations related to transportation system management, including transportation 
infrastructure management, maintenance, resilience, hazard mitigation, and vulnerable populations. Over 50% of the respondents 
reported having 15 or more years of work experience, with 27.5% having 25 or more years of experience. 

4.3. Measures 
The survey aimed to provide insights about the concerns of both users and experts regarding the performance and state of resilience 
of the transportation system. Respondents were asked to evaluate their level of concern about specific issues related to (i) the 
resilience practices of the experts and (ii) the safety and other resilience-related concerns of the populations. All questions were set 
within a pre-, peri-, and post-hazard timescale to capture different phases of the transportation system's resilience. The main sections 
of the surveys utilized a five-point Likert scale [1–5] for the questions. While the effectiveness of Likert scales has been a topic of debate 
[55], we opted to use this scale to minimize respondent confusion and maximize response rates, as well as to facilitate the handling 
of survey data [56,57]. By employing a standardized Likert scale, we aimed to ensure consistency and comparability in the re(
Image of Fig. 2) 
sponses received from both populations and experts surveys. 


Fig. 2. Rural areas in Florida (left), and the focus area of the study (right). 


M. AbdelMagid et al. 
4.4. Analysis 
The statistical analysis performed in the study included scoring and benchmarking the concerns of the experts and the vulnerablepopulation groups. Results from the analysis were used assess the current state of resilience of the transportation system as it relatesto the needs of vulnerable populations. This is done by (i) understanding the concerns of the vulnerable populations pre-, during, and 
post-natural hazards (the users' demands), and (ii) understanding the performance and health of the transportation system during natural 
hazards (e.g., the supply of the system). Spearman's rank-order correlation coefficients are used to measure the strength and direction 
of association between the study variables, since the variables in the survey were nonparametric variables [58–61]. The correlation 
coefficients were calculated for both the experts and the vulnerable populations' surveys, focusing on the Mobility & Resilience 
section, to understand if a particular concern is highly correlated to another during the different disaster phases (e.g., is the quality of 
the road network before the disaster related to the safety concerns of the populations during evacuations). To prioritize the concerns 
of the experts and the populations, the relative importance index (RII) was used [62–64]. The relative importance indices for the responses 
were calculated using the formula: 

? 


RII = 
wi?AN 

where wi the weighting given to each factor by the respondents (ranging from 1 to 5), A the highest level of concern (weight) possible 
in the scale of the survey question [5], and N the total number of respondents. 

5. Results 
5.1. Experts’ views: transportation systems performance & resilience practices 
The results of the analysis of the experts' survey reveal key insights into the performance of the transportation system, as well as 
equity issues in resilience planning. The analysis focused on two dimensions: physical resilience, which pertains to the resilience of infrastructure 
elements, and organizational resilience, which assesses the capacity of institutions to manage infrastructure resilience. 

Regarding physical resilience, the experts expressed significant concerns about the system's performance during natural hazards,
particularly with regard to supporting infrastructure elements. These elements include drainage systems, power and telecommunication 
infrastructure, and local roads. The experts identified these areas as critical points of vulnerability within the transportation system. 


In terms of organizational resilience, as shown in Fig. 3, the experts highlighted concerns related to the absence of documentationand dedicated resilience plans specifically designed to monitor the system's resilience for vulnerable populations during natural disasters. 
While 62.5% of the experts indicated that their organizations had plans addressing the needs of vulnerable populations, these 
plans were not tailored to the context of natural disasters. However, when considering resilience plans specifically, the percentage fell 
to 22.5%, indicating a lack of comprehensive measures to manage the needs of vulnerable populations post-hazard. The experts expressed 
uncertainty about how to effectively address the challenges faced by these populations in the aftermath of natural disasters. 

The results of the correlation analysis demonstrate a strong association between the absence of resilience plans and concerns regarding 
hazard-related economic and social impacts on vulnerable populations. Specifically, the mean score for economic impacts 
was 4.1 (out of 5), indicating a high level of concern, while the mean score for social impacts was 3.8. These findings emphasize the 
importance of resilience plans in mitigating adverse effects on vulnerable populations. 

To provide further insight, Tables 3 and 4 present the ranking of concerns expressed by the experts. Table 3 highlights the vulnera(
Image of Fig. 3) 
bility of infrastructure elements that contribute to lower system performance levels. This ranking assists ",Resilience; Transportation systems; resilience; Equity; Social justice; Asset management;Organizational resilience; vulnerable populations; Mobility vulnerability
